nazev;slug;seo_title;meta_description;keywords;canonical
Jak poznat, že si se mnou jen hraje?;jak-poznat-ze-si-se-mnou-jen-hraje.html;Jak poznat, že si se mnou jen hraje?;Signály, že druhý člověk možná nehledá vztah, ale jen pozornost. Jak číst chování bez unáhlených závěrů a manipulace.;hraje si se mnou, nezávazný flirt, vztahová nejistota, crush signály, nejasný zájem;https://crushmeter.cz/blog/jak-poznat-ze-si-se-mnou-jen-hraje.html
Proč mě přitahuje někdo, kdo o mě nestojí?;proc-me-pritahuje-nekdo-kdo-o-me-nestoji.html;Proč mě přitahuje někdo, kdo o mě nestojí?;Proč nás někdy táhne člověk, který nedává jasný zájem, a jak rozlišit chemii od honění nedostupné pozornosti.;přitahuje mě někdo kdo mě nechce, nedostupný člověk, vztahová chemie, neopětovaná láska, crush;https://crushmeter.cz/blog/proc-me-pritahuje-nekdo-kdo-o-me-nestoji.html
Jak poznat, že vztah nemá budoucnost;jak-poznat-ze-vztah-nema-budoucnost.html;Jak poznat, že vztah nemá budoucnost;Signály, že vztah možná ztrácí směr. Jak poznat rozdíl mezi krizí, nejistotou a dlouhodobě nefunkční dynamikou.;vztah nemá budoucnost, kdy ukončit vztah, vztahová krize, nefunkční vztah, vztahová kompatibilita;https://crushmeter.cz/blog/jak-poznat-ze-vztah-nema-budoucnost.html
Kdy dát druhou šanci a kdy už ne;kdy-dat-druhou-sanci.html;Kdy dát druhou šanci a kdy už ne;Druhá šance ve vztahu: kdy může mít smysl, kdy jde jen o opakování stejného zklamání a čeho si všímat.;druhá šance ve vztahu, kdy dát druhou šanci, návrat k bývalému, vztah po zklamání, vztahová důvěra;https://crushmeter.cz/blog/kdy-dat-druhou-sanci.html
Proč se bojím udělat první krok?;proc-se-bojim-udelat-prvni-krok.html;Proč se bojím udělat první krok u crushe?;Strach napsat první nebo projevit zájem je běžný. Jak s ním pracovat bez tlaku, her a zbytečného ponižování sebe sama.;bojím se udělat první krok, napsat crushovi, strach z odmítnutí, první krok ve vztahu, crush komunikace;https://crushmeter.cz/blog/proc-se-bojim-udelat-prvni-krok.html
Co znamená, když mi píše jen večer?;co-znamena-kdyz-mi-pise-jen-vecer.html;Co znamená, když mi píše jen večer?;Píše ti hlavně večer nebo v noci? Co to může naznačovat, kdy jde o zájem a kdy spíš o pohodlnou pozornost.;píše mi jen večer, noční zprávy, crush nejasné signály, nezávazný zájem, vztahová komunikace;https://crushmeter.cz/blog/co-znamena-kdyz-mi-pise-jen-vecer.html
Jak poznat, že mě bere jen jako kamaráda?;jak-poznat-ze-me-bere-jen-jako-kamarada.html;Jak poznat, že mě bere jen jako kamaráda?;Signály, že druhý člověk může vnímat vztah spíš kamarádsky. Jak rozlišit přátelství, flirt a nejasnou dynamiku.;bere mě jen jako kamaráda, friendzone, crush kamarád, flirt nebo kamarádství, neopětovaný zájem;https://crushmeter.cz/blog/jak-poznat-ze-me-bere-jen-jako-kamarada.html
Proč se vztah na začátku rychle změní?;proc-se-vztah-na-zacatku-zmeni.html;Proč se vztah na začátku rychle změní?;Na začátku zájem, chemie a zprávy každý den. Pak ochladnutí. Proč se to děje a co to může znamenat pro vztahový potenciál.;vztah se změnil na začátku, ochladnutí zájmu, začátek vztahu, crush ochladl, vztahová dynamika;https://crushmeter.cz/blog/proc-se-vztah-na-zacatku-zmeni.html
Jak poznat zdravý flirt a kdy už je to hra;jak-poznat-zdravy-flirt.html;Jak poznat zdravý flirt a kdy už je to hra;Flirt může být příjemný začátek vztahu, ale i zdroj nejistoty. Jak poznat rozdíl mezi zdravým zájmem a hrou s pozorností.;zdravý flirt, flirtování, hra s pozorností, crush flirt, vztahové signály;https://crushmeter.cz/blog/jak-poznat-zdravy-flirt.html
Proč mě přitahují špatné typy?;proc-me-pritahuji-spatne-typy.html;Proč mě přitahují špatné typy?;Proč nás někdy opakovaně přitahují lidé, kteří nám nesedí, a jak poznat vzorec dřív, než se znovu spálíme.;přitahují mě špatné typy, toxická přitažlivost, vztahové vzorce, nedostupní lidé, kompatibilita ve vztahu;https://crushmeter.cz/blog/proc-me-pritahuji-spatne-typy.html
Jak poznat jednostrannou komunikaci;jak-poznat-ze-komunikace-je-jednostranna.html;Jak poznat jednostrannou komunikaci;Táhneš komunikaci hlavně ty? Jak poznat jednostranný zájem, kdy dát prostor a kdy přestat investovat energii.;jednostranná komunikace, píšu první jen já, jednostranný zájem, crush neodepisuje, vztahová komunikace;https://crushmeter.cz/blog/jak-poznat-ze-komunikace-je-jednostranna.html
Kdy je čas přestat čekat na zprávu?;kdy-je-cas-prestat-cekavat-na-zpravu.html;Kdy je čas přestat čekat na zprávu?;Čekáš na zprávu od crushe nebo partnera? Jak poznat, kdy dát prostor a kdy už čekání bere příliš energie.;čekám na zprávu, crush neodepisuje, kdy přestat čekat, vztahová nejistota, komunikace ve vztahu;https://crushmeter.cz/blog/kdy-je-cas-prestat-cekavat-na-zpravu.html
Jak poznat, že je mezi námi napětí?;jak-poznat-ze-je-mezi-nami-napeti.html;Jak poznat, že je mezi námi napětí?;Vztahové napětí, chemie a nevyřčený zájem. Jak poznat signály, které mohou naznačovat přitažlivost, ale nejsou jistotou.;napětí mezi námi, chemie mezi lidmi, nevyřčený zájem, crush signály, přitažlivost;https://crushmeter.cz/blog/jak-poznat-ze-je-mezi-nami-napeti.html
